URL,Version,Status,OIDs,Name,Title,Description,Used
http://terminology.hl7.org/CodeSystem/v3-MaritalStatus,3.0.0,active,"2.16.840.1.113883.5.2",MaritalStatus,MaritalStatus,"\* \* \* No description supplied \* \* \*    *Open Issue:* The specific meanings of these codes can vary somewhat by jurisdiction and implementation so caution should be used when determining equivalency.    *Open Issue:* fixing and completion of the hierarchy and proper good definitions of all the concepts is badly needed.","ValueSet/marital-status"
http://terminology.hl7.org/CodeSystem/v3-NullFlavor,3.0.0,active,"2.16.840.1.113883.5.1008",NullFlavor,NullFlavor,"A collection of codes specifying why a valid value is not present.","ValueSet/marital-status,ValueSet/encounter-special-courtesy"
http://terminology.hl7.org/CodeSystem/v3-ObservationInterpretation,3.0.0,active,"2.16.840.1.113883.5.83",ObservationInterpretation,ObservationInterpretation,"One or more codes providing a rough qualitative interpretation of the observation, such as ""normal"" / ""abnormal"", ""low"" / ""high"", ""better"" / ""worse"", ""resistant"" / ""susceptible"", ""expected"" / ""not expected"". The value set is intended to be for ANY use where coded representation of an interpretation is needed.","ValueSet/observation-interpretation"
http://terminology.hl7.org/CodeSystem/v3-ParticipationType,5.0.0,active,"2.16.840.1.113883.5.90",ParticipationType,ParticipationType,"A code specifying the meaning and purpose of every Participation instance. Each of its values implies specific constraints on the Roles undertaking the participation.","ValueSet/encounter-participant-type"
https://dhin.org/2025Connectathon/CodeSystem/nigeria-facility-type,0.1.0,active,,NGFacilityTypeCS,NG-Imm Facility Type CS,"A standardized classification system used to describe the type or level of health facility within a healthcare delivery system, based on the scope of services provided, staffing, infrastructure, and administrative role.","ValueSet/nigeria-facility-types"
https://dhin.org/2025Connectathon/CodeSystem/nigeria-gender,0.1.0,active,,NGGenderCS,NG-Imm Gender CS,"The administrative gender of a person.","ValueSet/nigeria-gender"
https://dhin.org/2025Connectathon/CodeSystem/nigeria-languages,0.1.0,active,,NGLanguagesCS,NG‑Imm Languages in Nigeria CS,"This CodeSystem defines codes for major languages spoken across Nigeria.","ValueSet/nigeria-languages"
https://dhin.org/2025Connectathon/CodeSystem/nigeria-lgas,0.1.0,active,,NGLGAsCS,NG-Imm LGAs in Nigeria CS,"This CodeSystem defines LGA codes and names mapped to their respective States in Nigeria.","ValueSet/nigeria-lgas"
https://dhin.org/2025Connectathon/CodeSystem/nigeria-location-owner-cs,0.1.0,draft,,NGOrganizationOwnerCS,NG-Imm Location Owner CS,"This CodeSystem defines Immunization Location Owner.","ValueSet/nigeria-location-owner"
https://dhin.org/2025Connectathon/CodeSystem/nigeria-states,0.1.0,active,,NGStatesCS,NG-Imm States in Nigeria CS,"This CodeSystem defines ward codes and names mapped to their respective States in Nigeria.","ValueSet/nigeria-states"
https://dhin.org/2025Connectathon/CodeSystem/nigeria-wards,0.1.0,active,,NGWardsCS,NG-Imm Administrative Wards CS,"This CodeSystem defines ward codes and names mapped to their respective Local Government Areas (LGAs) in Nigeria.","ValueSet/nigeria-wards"
urn:ietf:bcp:47,2.0.1,active,"2.16.840.1.113883.6.121",Ietf3066,Tags for the Identification of Languages,"Older value from OID registry.  Superceded; see recommendations in BCP-47.","ValueSet/languages"
