URL,Version,Status,OIDs,Name,Title,Description,Used
http://hl7.org/fhir/CodeSystem/task-code,4.0.1,active,"2.16.840.1.113883.4.642.4.1397",TaskCode,Task Codes,"Codes indicating the type of action that is expected to be performed","ValueSet/task-code"
http://hl7.org/fhir/address-type,4.0.1,active,"2.16.840.1.113883.4.642.4.70",AddressType,AddressType,"The type of an address (physical / postal).","ValueSet/address-type"
http://hl7.org/fhir/address-use,4.0.1,active,"2.16.840.1.113883.4.642.4.68",AddressUse,AddressUse,"The use of an address.","ValueSet/address-use"
http://hl7.org/fhir/administrative-gender,4.0.1,active,"2.16.840.1.113883.4.642.4.2",AdministrativeGender,AdministrativeGender,"The gender of a person used for administrative purposes.","ValueSet/administrative-gender"
http://hl7.org/fhir/bundle-type,4.0.1,active,"2.16.840.1.113883.4.642.4.621",BundleType,BundleType,"Indicates the purpose of a bundle - how it is intended to be used.","ValueSet/bundle-type"
http://hl7.org/fhir/claim-use,4.0.1,draft,"2.16.840.1.113883.4.642.4.545",Use,Use,"The purpose of the Claim: predetermination, preauthorization, claim.","ValueSet/claim-use"
http://hl7.org/fhir/contact-point-system,4.0.1,active,"2.16.840.1.113883.4.642.4.72",ContactPointSystem,ContactPointSystem,"Telecommunications form for contact point.","ValueSet/contact-point-system"
http://hl7.org/fhir/contact-point-use,4.0.1,active,"2.16.840.1.113883.4.642.4.74",ContactPointUse,ContactPointUse,"Use of contact point.","ValueSet/contact-point-use"
http://hl7.org/fhir/days-of-week,4.0.1,active,"2.16.840.1.113883.4.642.4.513",DaysOfWeek,DaysOfWeek,"The days of the week.","ValueSet/days-of-week"
http://hl7.org/fhir/eligibilityrequest-purpose,4.0.1,draft,"2.16.840.1.113883.4.642.4.1183",EligibilityRequestPurpose,EligibilityRequestPurpose,"A code specifying the types of information being requested.","ValueSet/eligibilityrequest-purpose"
http://hl7.org/fhir/eligibilityresponse-purpose,4.0.1,draft,"2.16.840.1.113883.4.642.4.1185",EligibilityResponsePurpose,EligibilityResponsePurpose,"A code specifying the types of information being requested.","ValueSet/eligibilityresponse-purpose"
http://hl7.org/fhir/encounter-location-status,4.0.1,draft,"2.16.840.1.113883.4.642.4.263",EncounterLocationStatus,EncounterLocationStatus,"The status of the location.","ValueSet/encounter-location-status"
http://hl7.org/fhir/encounter-status,4.0.1,draft,"2.16.840.1.113883.4.642.4.247",EncounterStatus,EncounterStatus,"Current state of the encounter.","ValueSet/encounter-status"
http://hl7.org/fhir/event-status,4.0.1,draft,"2.16.840.1.113883.4.642.4.110",EventStatus,EventStatus,"Codes identifying the lifecycle stage of an event.","ValueSet/event-status"
http://hl7.org/fhir/explanationofbenefit-status,4.0.1,draft,"2.16.840.1.113883.4.642.4.619",ExplanationOfBenefitStatus,ExplanationOfBenefitStatus,"A code specifying the state of the resource instance.","ValueSet/explanationofbenefit-status"
http://hl7.org/fhir/fm-status,4.0.1,draft,"2.16.840.1.113883.4.642.4.593",FinancialResourceStatusCodes,Financial Resource Status Codes,"This value set includes Status codes.","ValueSet/fm-status"
http://hl7.org/fhir/http-verb,4.0.1,active,"2.16.840.1.113883.4.642.4.625",HTTPVerb,HTTPVerb,"HTTP verbs (in the HTTP command line). See [HTTP rfc](https://tools.ietf.org/html/rfc7231) for details.","ValueSet/http-verb"
http://hl7.org/fhir/identifier-use,4.0.1,active,"2.16.840.1.113883.4.642.4.58",IdentifierUse,IdentifierUse,"Identifies the purpose for this identifier, if known .","ValueSet/identifier-use"
http://hl7.org/fhir/invoice-priceComponentType,4.0.1,draft,"2.16.840.1.113883.4.642.4.869",InvoicePriceComponentType,InvoicePriceComponentType,"Codes indicating the kind of the price component.","ValueSet/invoice-priceComponentType"
http://hl7.org/fhir/invoice-status,4.0.1,draft,"2.16.840.1.113883.4.642.4.867",InvoiceStatus,InvoiceStatus,"Codes identifying the lifecycle stage of an Invoice.","ValueSet/invoice-status"
http://hl7.org/fhir/link-type,4.0.1,active,"2.16.840.1.113883.4.642.4.424",LinkType,LinkType,"The type of link between this patient resource and another patient resource.","ValueSet/link-type"
http://hl7.org/fhir/name-use,4.0.1,active,"2.16.840.1.113883.4.642.4.66",NameUse,NameUse,"The use of a human name.","ValueSet/name-use"
http://hl7.org/fhir/note-type,4.0.1,draft,"2.16.840.1.113883.4.642.4.16",NoteType,NoteType,"The presentation types of notes.","ValueSet/note-type"
http://hl7.org/fhir/observation-status,4.0.1,active,"2.16.840.1.113883.4.642.4.401",ObservationStatus,ObservationStatus,"Codes providing the status of an observation.","ValueSet/observation-status"
http://hl7.org/fhir/remittance-outcome,4.0.1,draft,"2.16.840.1.113883.4.642.4.14",ClaimProcessingCodes,Claim Processing Codes,"This value set includes Claim Processing Outcome codes.","ValueSet/remittance-outcome"
http://hl7.org/fhir/request-intent,4.0.1,draft,"2.16.840.1.113883.4.642.4.114",RequestIntent,RequestIntent,"Codes indicating the degree of authority/intentionality associated with a request.","ValueSet/task-intent"
http://hl7.org/fhir/request-priority,4.0.1,draft,"2.16.840.1.113883.4.642.4.116",RequestPriority,RequestPriority,"Identifies the level of importance to be assigned to actioning the request.","ValueSet/request-priority"
http://hl7.org/fhir/search-entry-mode,4.0.1,active,"2.16.840.1.113883.4.642.4.623",SearchEntryMode,SearchEntryMode,"Why an entry is in the result set - whether it's included as a match or because of an _include requirement, or to convey information or warning information about the search process.","ValueSet/search-entry-mode"
http://hl7.org/fhir/sid/ex-icd-10-procedures,4.0.1,draft,"2.16.840.1.113883.4.642.4.575",ICD-10ProcedureCodes,ICD-10 Procedure Codes,"This value set includes sample ICD-10 Procedure codes.","ValueSet/icd-10-procedures"
http://hl7.org/fhir/sid/icd-10,2.1.1,retired,"2.16.840.1.113883.6.3",Icd10,ICD-10,"International Classification of Diseases revision 10 (ICD 10)","ValueSet/icd-10"
http://hl7.org/fhir/task-intent,4.0.1,draft,"2.16.840.1.113883.4.642.4.1241",TaskIntent,TaskIntent,"Distinguishes whether the task is a proposal, plan or full order.","ValueSet/task-intent"
http://hl7.org/fhir/task-status,4.0.1,draft,"2.16.840.1.113883.4.642.4.791",TaskStatus,TaskStatus,"The current status of the task.","ValueSet/task-status"
http://loinc.org,3.1.0,active,"2.16.840.1.113883.6.1",LOINC,Logical Observation Identifiers, Names and Codes (LOINC),"LOINC provides a set of universal names and ID codes for identifying laboratory and clinical test results.1,2 LOINC facilitates the exchange and pooling of results, such as blood hemoglobin, serum potassium, or vital signs, for clinical care, outcomes management, and research. LOINC's universal identifiers (names and codes) can be used in the context of order and observation exchanges between information systems that use syntax standards such as HL73, CEN TC251, ISO TC215, ASTM4, and DICOM. Specifically, the identifier can be used as the coded value for an observation in any other standard that uses the observation/observation value paradigm, whether messages, documents, application programming interface (API), etc. For example, LOINC codes are used widely in the OBX segment Observation Identifier field (OBX-3) of an ORU HL7 (HL7 version 2.x or ASTM 1238-9410) message that may be sent between a Clinical Laboratory Information Management Systems (LIMS) and Electronic Health Record Systems (EHR).5, 6 In this way, LOINC codes provide universal identifiers that allow the exchange of clinical data between heterogeneous computing environments.","ValueSet/observation-codes"
http://snomed.info/sct,null,active,"2.16.840.1.113883.6.96",SNOMED_CT,SNOMED CT (all versions),"SNOMED CT is the most comprehensive and precise clinical health terminology product in the world, owned and distributed around the world by The International Health Terminology Standards Development Organisation (IHTSDO).","ValueSet/device-kind,ValueSet/performer-role,ValueSet/referencerange-appliesto,ValueSet/encounter-reason,ValueSet/c80-practice-codes,ValueSet/procedure-outcome,ValueSet/procedure-reason,ValueSet/procedure-category,ValueSet/procedure-followup,ValueSet/condition-code,ValueSet/practitioner-role,ValueSet/device-action,ValueSet/procedure-not-performed-reason,ValueSet/observation-methods,ValueSet/body-site,ValueSet/procedure-code"
http://terminology.hl7.org/CodeSystem/FDI-surface,1.0.0,draft,"2.16.840.1.113883.4.642.1.1154",SurfaceCodes,Surface Codes,"This value set includes a smattering of FDI tooth surface codes.","ValueSet/surface"
http://terminology.hl7.org/CodeSystem/adjudication,1.0.1,active,"2.16.840.1.113883.4.642.1.1171",AdjudicationValueCodes,Adjudication Value Codes,"This value set includes a smattering of Adjudication Value codes which includes codes to indicate the amounts eligible under the plan, the amount of benefit, copays etc.","ValueSet/adjudication"
http://terminology.hl7.org/CodeSystem/adjudication-error,1.0.1,active,"2.16.840.1.113883.4.642.1.1053",AdjudicationErrorCodes,Adjudication Error Codes,"This value set includes a smattering of adjudication codes.","ValueSet/adjudication-error"
http://terminology.hl7.org/CodeSystem/adjudication-reason,1.0.1,active,"2.16.840.1.113883.4.642.1.1172",AdjudicationReasonCodes,Adjudication Reason Codes,"This value set includes smattering of Adjudication Reason codes.","ValueSet/adjudication-reason"
http://terminology.hl7.org/CodeSystem/admit-source,1.0.1,active,"2.16.840.1.113883.4.642.1.1092",AdmitSource,Admit source,"This value set defines a set of codes that can be used to indicate from where the patient came in.","ValueSet/encounter-admit-source"
http://terminology.hl7.org/CodeSystem/benefit-network,2.0.0,active,"2.16.840.1.113883.4.642.1.1177",NetworkTypeCodes,Network Type Codes,"This code system represents the contractual relationship between a provider and payer for administrative purposes for a specific patient, service, or product.","ValueSet/benefit-network"
http://terminology.hl7.org/CodeSystem/benefit-term,1.0.1,active,"2.16.840.1.113883.4.642.1.1179",BenefitTermCodes,Benefit Term Codes,"This value set includes a smattering of Benefit Term codes.","ValueSet/benefit-term"
http://terminology.hl7.org/CodeSystem/benefit-type,1.0.1,active,"2.16.840.1.113883.4.642.1.1176",BenefitTypeCodes,Benefit Type Codes,"This value set includes a smattering of Benefit type codes.","ValueSet/benefit-type"
http://terminology.hl7.org/CodeSystem/benefit-unit,1.0.1,active,"2.16.840.1.113883.4.642.1.1178",UnitTypeCodes,Unit Type Codes,"This value set includes a smattering of Unit type codes.","ValueSet/benefit-unit"
http://terminology.hl7.org/CodeSystem/claim-exception,1.0.1,active,"2.16.840.1.113883.4.642.1.1162",ExceptionCodes,Exception Codes,"This value set includes sample Exception codes.","ValueSet/claim-exception"
http://terminology.hl7.org/CodeSystem/claim-type,1.0.1,active,"2.16.840.1.113883.4.642.1.1156",ClaimTypeCodes,Claim Type Codes,"This value set includes Claim Type codes.","ValueSet/claim-type"
http://terminology.hl7.org/CodeSystem/claimcareteamrole,1.0.1,active,"2.16.840.1.113883.4.642.1.1165",ClaimCareTeamRoleCodes,Claim Care Team Role Codes,"Claim roles of the care team members providing products and services.","ValueSet/claim-careteamrole"
http://terminology.hl7.org/CodeSystem/claiminformationcategory,1.0.1,active,"2.16.840.1.113883.4.642.1.1163",ClaimInformationCategoryCodes,Claim Information Category Codes,"This value set includes sample Information Category codes.","ValueSet/claim-informationcategory"
http://terminology.hl7.org/CodeSystem/common-tags,1.0.1,active,"2.16.840.1.113883.4.642.1.1067",CommonTags,Common Tags,"Common Tag Codes defined by FHIR project","ValueSet/common-tags"
http://terminology.hl7.org/CodeSystem/contactentity-type,1.0.0,draft,"2.16.840.1.113883.4.642.1.1129",ContactEntityType,Contact entity type,"This example value set defines a set of codes that can be used to indicate the purpose for which you would contact a contact party.","ValueSet/contactentity-type"
http://terminology.hl7.org/CodeSystem/coverage-class,1.0.1,active,"2.16.840.1.113883.4.642.1.1147",CoverageClassCodes,Coverage Class Codes,"This value set includes Coverage Class codes.","ValueSet/coverage-class"
http://terminology.hl7.org/CodeSystem/coverage-copay-type,1.0.1,active,"2.16.840.1.113883.4.642.1.1149",CoverageCopayTypeCodes,Coverage Copay Type Codes,"This value set includes sample Coverage Copayment Type codes.","ValueSet/coverage-copay-type"
http://terminology.hl7.org/CodeSystem/coverage-selfpay,1.0.1,active,"2.16.840.1.113883.4.642.1.1148",CoverageSelfPayCodes,Coverage SelfPay Codes,"This value set includes Coverage SelfPay codes.","ValueSet/coverage-type"
http://terminology.hl7.org/CodeSystem/coverageeligibilityresponse-ex-auth-support,1.0.1,active,"2.16.840.1.113883.4.642.1.1394",CoverageEligibilityResponseAuthSupportCodes,CoverageEligibilityResponse Auth Support Codes,"This value set includes CoverageEligibilityResponse Auth Support codes.","ValueSet/coverageeligibilityresponse-ex-auth-support"
http://terminology.hl7.org/CodeSystem/data-absent-reason,1.0.0,active,"2.16.840.1.113883.4.642.4.1048",DataAbsentReason,DataAbsentReason,"Used to specify why the normally expected content of the data element is missing.","ValueSet/data-absent-reason"
http://terminology.hl7.org/CodeSystem/diagnosis-role,1.1.1,active,"2.16.840.1.113883.4.642.1.1054",DiagnosisRole,Diagnosis Role,"This value set defines a set of codes that can be used to express the role of a diagnosis on the Encounter or EpisodeOfCare record.","ValueSet/diagnosis-role"
http://terminology.hl7.org/CodeSystem/diet,1.0.1,active,"2.16.840.1.113883.4.642.1.1091",Diet,Diet,"This value set defines a set of codes that can be used to indicate dietary preferences or restrictions a patient may have.","ValueSet/encounter-diet"
http://terminology.hl7.org/CodeSystem/discharge-disposition,1.0.1,active,"2.16.840.1.113883.4.642.1.1093",DischargeDisposition,Discharge disposition,"This value set defines a set of codes that can be used to where the patient left the hospital.","ValueSet/encounter-discharge-disposition"
http://terminology.hl7.org/CodeSystem/encounter-special-arrangements,1.0.1,active,"2.16.840.1.113883.4.642.1.1090",SpecialArrangements,Special arrangements,"This value set defines a set of codes that can be used to indicate the kinds of special arrangements in place for a patients visit.","ValueSet/encounter-special-arrangements"
http://terminology.hl7.org/CodeSystem/encounter-type,1.0.1,active,"2.16.840.1.113883.4.642.1.1088",EncounterType,Encounter type,"This example value set defines a set of codes that can be used to indicate the type of encounter: a specific code indicating type of service provided.","ValueSet/encounter-type"
http://terminology.hl7.org/CodeSystem/ex-USCLS,1.0.0,draft,"2.16.840.1.113883.4.642.1.1153",USCLSCodes,USCLS Codes,"This value set includes a smattering of USCLS codes.","ValueSet/service-uscls"
http://terminology.hl7.org/CodeSystem/ex-benefitcategory,1.0.1,active,"2.16.840.1.113883.4.642.1.1175",BenefitCategoryCodes,Benefit Category Codes,"This value set includes examples of Benefit Category codes.","ValueSet/ex-benefitcategory"
http://terminology.hl7.org/CodeSystem/ex-claimsubtype,1.0.1,active,"2.16.840.1.113883.4.642.1.1158",ExampleClaimSubTypeCodes,Example Claim SubType Codes,"This value set includes sample Claim SubType codes which are used to distinguish the claim types for example within type institutional there may be subtypes for emergency services, bed stay and transportation.","ValueSet/claim-subtype"
http://terminology.hl7.org/CodeSystem/ex-coverage-financial-exception,1.0.1,active,"2.16.840.1.113883.4.642.1.1329",ExampleCoverageFinancialExceptionCodes,Example Coverage Financial Exception Codes,"This value set includes Example Coverage Financial Exception Codes.","ValueSet/coverage-financial-exception"
http://terminology.hl7.org/CodeSystem/ex-diagnosis-on-admission,1.0.1,active,"2.16.840.1.113883.4.642.1.1170",ExampleDiagnosisOnAdmissionCodes,Example Diagnosis on Admission Codes,"This value set includes example Diagnosis on Admission codes.","ValueSet/ex-diagnosis-on-admission"
http://terminology.hl7.org/CodeSystem/ex-diagnosisrelatedgroup,1.0.1,active,"2.16.840.1.113883.4.642.1.1166",ExampleDiagnosisRelatedGroupCodes,Example Diagnosis Related Group Codes,"This value set includes example Diagnosis Related Group codes.","ValueSet/ex-diagnosisrelatedgroup"
http://terminology.hl7.org/CodeSystem/ex-diagnosistype,1.0.1,active,"2.16.840.1.113883.4.642.1.1167",ExampleDiagnosisTypeCodes,Example Diagnosis Type Codes,"This value set includes example Diagnosis Type codes.","ValueSet/ex-diagnosistype"
http://terminology.hl7.org/CodeSystem/ex-paymenttype,1.0.1,active,"2.16.840.1.113883.4.642.1.1181",ExamplePaymentTypeCodes,Example Payment Type Codes,"This value set includes example Payment Type codes.","ValueSet/ex-paymenttype"
http://terminology.hl7.org/CodeSystem/ex-procedure-type,1.0.1,active,"2.16.840.1.113883.4.642.1.1388",ExampleProcedureTypeCodes,Example Procedure Type Codes,"This value set includes example Procedure Type codes.","ValueSet/ex-procedure-type"
http://terminology.hl7.org/CodeSystem/ex-programcode,1.0.1,active,"2.16.840.1.113883.4.642.1.1161",ExampleProgramReasonCodes,Example Program Reason Codes,"This value set includes sample Program Reason Span codes.","ValueSet/ex-program-code"
http://terminology.hl7.org/CodeSystem/ex-providerqualification,1.0.1,active,"2.16.840.1.113883.4.642.1.1160",ExampleProviderQualificationCodes,Example Provider Qualification Codes,"This value set includes sample Provider Qualification codes.","ValueSet/provider-qualification"
http://terminology.hl7.org/CodeSystem/ex-relatedclaimrelationship,1.0.1,active,"2.16.840.1.113883.4.642.1.1159",ExampleRelatedClaimRelationshipCodes,Example Related Claim Relationship Codes,"This value set includes sample Related Claim Relationship codes.","ValueSet/related-claim-relationship"
http://terminology.hl7.org/CodeSystem/ex-revenue-center,1.0.1,active,"2.16.840.1.113883.4.642.1.1168",ExampleRevenueCenterCodes,Example Revenue Center Codes,"This value set includes sample Revenue Center codes.","ValueSet/ex-revenue-center"
http://terminology.hl7.org/CodeSystem/ex-serviceplace,1.0.1,active,"2.16.840.1.113883.4.642.1.1157",ExampleServicePlaceCodes,Example Service Place Codes,"This value set includes a smattering of Service Place codes.","ValueSet/service-place"
http://terminology.hl7.org/CodeSystem/ex-tooth,1.0.0,draft,"2.16.840.1.113883.4.642.1.1152",OralSiteCodes,Oral Site Codes,"This value set includes a smattering of FDI oral site codes.","ValueSet/tooth"
http://terminology.hl7.org/CodeSystem/forms-codes,1.0.1,active,"2.16.840.1.113883.4.642.1.1052",FormCodes,Form Codes,"This value set includes a sample set of Forms codes.","ValueSet/forms"
http://terminology.hl7.org/CodeSystem/fundsreserve,1.0.1,active,"2.16.840.1.113883.4.642.1.1051",FundsReservationCodes,Funds Reservation Codes,"This value set includes sample funds reservation type codes.","ValueSet/fundsreserve"
http://terminology.hl7.org/CodeSystem/location-physical-type,2.0.1,active,"2.16.840.1.113883.4.642.1.1108",LocationType,Location type,"This example value set defines a set of codes that can be used to indicate the physical form of the Location.  This includes several 'non physical' codes which are still considered a location.","ValueSet/location-physical-type"
http://terminology.hl7.org/CodeSystem/missingtoothreason,1.0.1,active,"2.16.840.1.113883.4.642.1.1150",MissingToothReasonCodes,Missing Tooth Reason Codes,"This value set includes sample Missing Tooth Reason codes.","ValueSet/missing-tooth-reason"
http://terminology.hl7.org/CodeSystem/modifiers,1.0.1,active,"2.16.840.1.113883.4.642.1.1151",ModifierTypeCodes,Modifier type Codes,"This value set includes sample Modifier type codes.","ValueSet/claim-modifiers"
http://terminology.hl7.org/CodeSystem/observation-category,1.0.1,active,"2.16.840.1.113883.4.642.1.1125",ObservationCategoryCodes,Observation Category Codes,"Observation Category codes.","ValueSet/observation-category"
http://terminology.hl7.org/CodeSystem/participant-type,1.0.1,active,"2.16.840.1.113883.4.642.1.1089",ParticipantType,Participant type,"This value set defines a set of codes that can be used to indicate how an individual participates in an encounter.","ValueSet/encounter-participant-type"
http://terminology.hl7.org/CodeSystem/payeetype,1.0.1,active,"2.16.840.1.113883.4.642.1.1050",ClaimPayeeTypeCodes,Payee Type Codes,"Codes indicating the type of party to be reimbursed for cost of products and services.","ValueSet/payeetype"
http://terminology.hl7.org/CodeSystem/payment-adjustment-reason,1.0.1,active,"2.16.840.1.113883.4.642.1.1173",PaymentAdjustmentReasonCodes,Payment Adjustment Reason Codes,"This value set includes smattering of Payment Adjustment Reason codes.","ValueSet/payment-adjustment-reason"
http://terminology.hl7.org/CodeSystem/practitioner-role,1.0.1,active,"2.16.840.1.113883.4.642.1.1132",PractitionerRole,Practitioner role,"This example value set defines a set of codes that can be used to indicate the role of a Practitioner.","ValueSet/practitioner-role"
http://terminology.hl7.org/CodeSystem/processpriority,1.0.1,active,"2.16.840.1.113883.4.642.1.1155",ProcessPriorityCodes,Process Priority Codes,"This value set includes the financial processing priority codes.","ValueSet/process-priority"
http://terminology.hl7.org/CodeSystem/referencerange-meaning,1.0.1,active,"2.16.840.1.113883.4.642.1.1124",ObservationReferenceRangeMeaningCodes,Observation Reference Range Meaning Codes,"This value set defines a set of codes that can be used to indicate the meaning/use of a reference range for a particular target population.","ValueSet/referencerange-meaning"
http://terminology.hl7.org/CodeSystem/service-type,1.1.1,active,"2.16.840.1.113883.4.642.1.1145",ServiceType,Service type,"This value set defines an example set of codes of service-types.","ValueSet/service-type"
http://terminology.hl7.org/CodeSystem/subscriber-relationship,1.0.1,active,"2.16.840.1.113883.4.642.1.1386",SubscriberRelationshipCodes,SubscriberPolicyholder Relationship Codes,"This value set includes codes for the relationship between the Subscriber and the Beneficiary (insured/covered party/patient).","ValueSet/subscriber-relationship"
http://terminology.hl7.org/CodeSystem/v2-0092,2.0.0,active,"2.16.840.1.113883.18.36",ReAdmissionIndicator,re-admissionIndicator,"Code system of concepts which are used to specify that a patient is being re admitted to a healthcare facilityin from which they were discharged, and indicates the circumstances around such re-admission.  Used in HL7 Version 2.x messagine in the PV1 segment.","ValueSet/v2-0092"
http://terminology.hl7.org/CodeSystem/v2-0131,2.0.0,active,"2.16.840.1.113883.18.58",ContactRole2,contactRole2,"Code system of concepts which specify a relationship role that the next of kin/associated parties plays with regard to the patient. Also used in referrals, for example, it may be necessary to identify the contact representative at the clinic that sent a referral. Used in HL7 Version 2 messaging in the NK1 and CTD segments after 2.5, when it replace 2.16.840.1.113883.18.57.","ValueSet/patient-contactrelationship"
http://terminology.hl7.org/CodeSystem/v2-0203,5.0.0,active,"2.16.840.1.113883.18.108",IdentifierType,identifierType,"HL7-defined code system of concepts specifying type of identifier. Used in HL7 Version 2.x messaging data types CX, PLN, PPN, XCN and XON.","ValueSet/identifier-type"
http://terminology.hl7.org/CodeSystem/v3-ActCode,9.0.0,active,"2.16.840.1.113883.5.4",ActCode,ActCode,"A code specifying the particular kind of Act that the Act-instance represents within its class.    *Constraints:* The kind of Act (e.g. physical examination, serum potassium, inpatient encounter, charge financial transaction, etc.) is specified with a code from one of several, typically external, coding systems. The coding system will depend on the class of Act, such as LOINC for observations, etc.    Conceptually, the Act.code must be a specialization of the Act.classCode. This is why the structure of ActClass domain should be reflected in the superstructure of the ActCode domain and then individual codes or externally referenced vocabularies subordinated under these domains that reflect the ActClass structure.    Act.classCode and Act.code are not modifiers of each other but the Act.code concept should really imply the Act.classCode concept. For a negative example, it is not appropriate to use an Act.code ""potassium"" together with and Act.classCode for ""laboratory observation"" to somehow mean ""potassium laboratory observation"" and then use the same Act.code for ""potassium"" together with Act.classCode for ""medication"" to mean ""substitution of potassium"". This mutually modifying use of Act.code and Act.classCode is not permitted.","ValueSet/v3-ActIncidentCode,ValueSet/v3-ActEncounterCode"
http://terminology.hl7.org/CodeSystem/v3-ActPriority,3.0.0,active,"2.16.840.1.113883.5.7",ActPriority,ActPriority,"A set of codes (e.g., for routine, emergency), specifying the urgency under which the Act happened, can happen, is happening, is intended to happen, or is requested/demanded to happen.","ValueSet/v3-ActPriority"
http://terminology.hl7.org/CodeSystem/v3-EncounterSpecialCourtesy,3.0.0,active,"2.16.840.1.113883.5.40",EncounterSpecialCourtesy,EncounterSpecialCourtesy,"**** MISSING DESCRIPTION ****","ValueSet/encounter-special-courtesy"
